{
  "@context": "https://agentpassport.org/v0.1",
  "spec_version": "0.1.0",
  "type": "WorkReceipt",
  "receipt_id": "550e8400-e29b-41d4-a716-446655440000",
  "job_id": "550e8400-e29b-41d4-a716-446655440001",
  "agent_did": "did:key:z6MkkMQwqqzaGVosmwTZcA6yGjHYfS6gkd3t4Nrdhgfas3p8",
  "client_did": "did:key:z6Mkk1eYqhX5edeYGSXQiX6JeDtT7RDzJyCMwY3EdW5SFGSn",
  "agent_snapshot": {
    "version": 1,
    "hash": "0x8a23e0a390d9aa47dadc7ea1cd558b1516be3c5e3c170b6b3c4f0da4ba54e08a"
  },
  "events": [
    {
      "type": "claim",
      "timestamp": "2026-02-15T15:46:14Z",
      "payload_hash": "0xfd0fcea875fcce23e98da8bc20833c6103f395865e52e5f2806367593b8fc8a4",
      "signature": "636c61696d2d7369672d706c616365686f6c646572"
    },
    {
      "type": "submit",
      "timestamp": "2026-02-15T16:06:14Z",
      "payload_hash": "0x5891ffda2969e131637d8e68a5e74a3be008b48b9c71a5459fad28f4da7b6807",
      "signature": "7375626d69742d7369672d706c616365686f6c646572"
    },
    {
      "type": "verify",
      "timestamp": "2026-02-15T16:11:14Z",
      "payload_hash": "0x42c13ac9a7a7d75f1bc7b10c163518a8e7626563bdeb9466468ac0292e09a17e",
      "signature": "7665726966792d7369672d706c616365686f6c646572",
      "result": {
        "status": "accepted",
        "score": 92
      }
    },
    {
      "type": "payout",
      "timestamp": "2026-02-15T16:16:14Z",
      "payload_hash": "0xf98807b29683a92ec7e435fb20bd978901658c77449a0218c282195b25e49e71",
      "signature": "7061796f75742d7369672d706c616365686f6c646572",
      "amount": {
        "value": 750,
        "unit": "points"
      }
    }
  ],
  "receipt_hash": "0xb87de4dbf7bf4b417577128b16b0616d1ad0a75dde03448933d98fec583242f1",
  "proof": {
    "type": "Ed25519Signature2020",
    "created": "2026-02-15T16:16:14Z",
    "verification_method": "did:key:z6MkkMQwqqzaGVosmwTZcA6yGjHYfS6gkd3t4Nrdhgfas3p8#key-1",
    "proof_purpose": "assertionMethod",
    "proof_value": "4d45e68be22e7a7c9e036dc017e036f0ca0d9d0cc086a3f58414928283028a101805e95e679557892279ced7c17951fb6da4626105642f1e5f6d9b7a23a62501"
  }
}